{
  "schema": "covguard.report.v1",
  "tool": {
    "name": "covguard",
    "version": "0.1.0"
  },
  "run": {
    "started_at": "2026-02-03T00:54:21Z"
  },
  "verdict": {
    "status": "pass",
    "counts": {
      "info": 0,
      "warn": 0,
      "error": 0
    },
    "reasons": [
      "diff_covered"
    ]
  },
  "findings": [],
  "data": {
    "scope": "added",
    "threshold_pct": 80.0,
    "changed_lines_total": 3,
    "covered_lines": 3,
    "uncovered_lines": 0,
    "missing_lines": 0,
    "diff_coverage_pct": 100.0,
    "inputs": {
      "diff_source": "diff-file",
      "diff_file": "fixtures/diff/simple_added.patch",
      "lcov_paths": [
        "fixtures/lcov/covered.info"
      ]
    }
  }
}