{
  "schema": "sensor.report.v1",
  "tool": {
    "name": "covguard",
    "version": "0.2.0"
  },
  "run": {
    "started_at": "2026-02-02T00:00:00Z",
    "ended_at": "2026-02-02T00:00:00Z",
    "duration_ms": 0,
    "capabilities": {
      "inputs": {
        "diff": {
          "status": "available"
        },
        "coverage": {
          "status": "unavailable",
          "reason": "missing_lcov"
        }
      }
    }
  },
  "verdict": {
    "status": "skip",
    "counts": {
      "info": 0,
      "warn": 0,
      "error": 0
    },
    "reasons": [
      "missing_lcov"
    ]
  },
  "findings": [],
  "data": {
    "scope": "added",
    "threshold_pct": 80.0,
    "changed_lines_total": 0,
    "covered_lines": 0,
    "uncovered_lines": 0,
    "missing_lines": 0,
    "diff_coverage_pct": 0.0,
    "inputs": {
      "diff_source": "diff-file",
      "diff_file": "test.patch",
      "lcov_paths": []
    }
  }
}
