{
  "schema": "covguard.report.v1",
  "tool": {
    "name": "covguard",
    "version": "0.1.0"
  },
  "run": {
    "started_at": "2026-02-03T10:15:12Z"
  },
  "verdict": {
    "status": "fail",
    "counts": {
      "info": 0,
      "warn": 0,
      "error": 4
    },
    "reasons": [
      "uncovered_lines",
      "below_threshold"
    ]
  },
  "findings": [
    {
      "severity": "error",
      "check_id": "diff.coverage_below_threshold",
      "code": "covguard.diff.coverage_below_threshold",
      "message": "Diff coverage 0.0% is below threshold 80.0%.",
      "data": {
        "actual_pct": 0.0,
        "threshold_pct": 80.0
      }
    },
    {
      "severity": "error",
      "check_id": "diff.uncovered_line",
      "code": "covguard.diff.uncovered_line",
      "message": "Uncovered changed line (hits=0).",
      "location": {
        "path": "src/lib.rs",
        "line": 1
      },
      "data": {
        "hits": 0
      }
    },
    {
      "severity": "error",
      "check_id": "diff.uncovered_line",
      "code": "covguard.diff.uncovered_line",
      "message": "Uncovered changed line (hits=0).",
      "location": {
        "path": "src/lib.rs",
        "line": 2
      },
      "data": {
        "hits": 0
      }
    },
    {
      "severity": "error",
      "check_id": "diff.uncovered_line",
      "code": "covguard.diff.uncovered_line",
      "message": "Uncovered changed line (hits=0).",
      "location": {
        "path": "src/lib.rs",
        "line": 3
      },
      "data": {
        "hits": 0
      }
    }
  ],
  "data": {
    "scope": "added",
    "threshold_pct": 80.0,
    "changed_lines_total": 3,
    "covered_lines": 0,
    "uncovered_lines": 3,
    "missing_lines": 0,
    "diff_coverage_pct": 0.0,
    "inputs": {
      "diff_source": "diff-file",
      "diff_file": "fixtures/diff/simple_added.patch",
      "lcov_paths": [
        "fixtures/lcov/uncovered.info"
      ]
    }
  }
}