{
  "schema": "covguard.report.v1",
  "tool": {
    "name": "covguard",
    "version": "0.1.0"
  },
  "run": {
    "started_at": "2026-03-27T08:31:23Z",
    "ended_at": "2026-03-27T08:31:23Z",
    "duration_ms": 0
  },
  "verdict": {
    "status": "fail",
    "counts": {
      "info": 0,
      "warn": 1,
      "error": 1
    },
    "reasons": [
      "below_threshold"
    ]
  },
  "findings": [
    {
      "severity": "error",
      "check_id": "diff.coverage_below_threshold",
      "code": "covguard.diff.coverage_below_threshold",
      "message": "Diff coverage 0.0% is below threshold 80.0%.",
      "data": {
        "actual_pct": 0.0,
        "threshold_pct": 80.0
      },
      "fingerprint": "6c18d8fbfefc01c0723fb41eb3f780c0998ba9e5c330486cadd25cfcd55af0db"
    },
    {
      "severity": "warn",
      "check_id": "diff.missing_coverage_for_file",
      "code": "covguard.diff.missing_coverage_for_file",
      "message": "Missing coverage data for file (3 line(s) without coverage).",
      "location": {
        "path": "src/lib.rs"
      },
      "data": {
        "missing_file": true,
        "missing_lines": 3
      },
      "fingerprint": "d582410a0c5bec36b27d77133d2dde2c574c88dd4e8cc8db10935900ecf0d8ba"
    }
  ],
  "data": {
    "scope": "added",
    "threshold_pct": 80.0,
    "changed_lines_total": 3,
    "covered_lines": 0,
    "uncovered_lines": 0,
    "missing_lines": 3,
    "diff_coverage_pct": 0.0,
    "inputs": {
      "diff_source": "diff-file",
      "diff_file": "fixtures/diff/simple_added.patch",
      "lcov_paths": []
    }
  }
}