{
  "schema": "covguard.report.v1",
  "tool": {
    "name": "covguard",
    "version": "0.2.0"
  },
  "run": {
    "started_at": "2026-02-02T00:00:00Z"
  },
  "verdict": {
    "status": "fail",
    "counts": {
      "info": 0,
      "warn": 0,
      "error": 3
    },
    "reasons": [
      "uncovered_lines"
    ]
  },
  "findings": [
    {
      "severity": "error",
      "check_id": "diff.uncovered_line",
      "code": "covguard.diff.uncovered_line",
      "message": "Uncovered changed line (hits=0).",
      "location": {
        "path": "src/lib.rs",
        "line": 1
      },
      "data": {
        "hits": 0
      },
      "fingerprint": "093fb6ce4bb86c6ed235bdb2d75cecfba12a783a07039fe5495324f3448e8d6f"
    },
    {
      "severity": "error",
      "check_id": "diff.uncovered_line",
      "code": "covguard.diff.uncovered_line",
      "message": "Uncovered changed line (hits=0).",
      "location": {
        "path": "src/lib.rs",
        "line": 2
      },
      "data": {
        "hits": 0
      },
      "fingerprint": "6cf387b790a59a363792c0f904f0d52218112133c35d59914940c0e0c1674873"
    },
    {
      "severity": "error",
      "check_id": "diff.uncovered_line",
      "code": "covguard.diff.uncovered_line",
      "message": "Uncovered changed line (hits=0).",
      "location": {
        "path": "src/lib.rs",
        "line": 3
      },
      "data": {
        "hits": 0
      },
      "fingerprint": "b01a083c2c28cdd8b3ea384181ed19eaad88c530dd206a83853e3d1cc1baaa74"
    }
  ],
  "data": {
    "scope": "added",
    "threshold_pct": 80.0,
    "changed_lines_total": 3,
    "covered_lines": 0,
    "uncovered_lines": 3,
    "missing_lines": 0,
    "diff_coverage_pct": 0.0,
    "inputs": {
      "diff_source": "diff-file",
      "diff_file": "fixtures/diff/simple_added.patch",
      "lcov_paths": [
        "fixtures/lcov/uncovered.info"
      ]
    }
  }
}
