{
  "schema": "sensor.report.v1",
  "tool": {
    "name": "covguard",
    "version": "0.2.0"
  },
  "run": {
    "started_at": "2026-02-02T00:00:00Z",
    "ended_at": "2026-02-02T00:00:01Z",
    "duration_ms": 1000,
    "capabilities": {
      "inputs": {
        "diff": {
          "status": "available"
        },
        "coverage": {
          "status": "available"
        }
      }
    }
  },
  "verdict": {
    "status": "fail",
    "counts": {
      "info": 0,
      "warn": 0,
      "error": 5
    },
    "reasons": [
      "uncovered_lines",
      "truncated"
    ]
  },
  "findings": [
    {
      "severity": "error",
      "check_id": "diff.uncovered_line",
      "code": "covguard.diff.uncovered_line",
      "message": "Uncovered changed line (hits=0).",
      "location": {
        "path": "src/lib.rs",
        "line": 1
      },
      "data": {
        "hits": 0
      },
      "fingerprint": "a1b2c3d4e5f6a1b2c3d4e5f6a1b2c3d4e5f6a1b2c3d4e5f6a1b2c3d4e5f6a1b2"
    },
    {
      "severity": "error",
      "check_id": "diff.uncovered_line",
      "code": "covguard.diff.uncovered_line",
      "message": "Uncovered changed line (hits=0).",
      "location": {
        "path": "src/lib.rs",
        "line": 2
      },
      "data": {
        "hits": 0
      },
      "fingerprint": "b2c3d4e5f6a1b2c3d4e5f6a1b2c3d4e5f6a1b2c3d4e5f6a1b2c3d4e5f6a1b2c3"
    }
  ],
  "data": {
    "scope": "added",
    "threshold_pct": 80.0,
    "changed_lines_total": 5,
    "covered_lines": 0,
    "uncovered_lines": 5,
    "missing_lines": 0,
    "diff_coverage_pct": 0.0,
    "inputs": {
      "diff_source": "diff-file",
      "diff_file": "test.patch",
      "lcov_paths": [
        "coverage.info"
      ]
    },
    "truncation": {
      "findings_truncated": true,
      "shown": 2,
      "total": 5
    }
  }
}
